{
  "run_id": "nightly-2026-10-21",
  "status": "NOT_RUN",
  "not_run_reason": "no access: the fixture loader (Tushe sandbox) is not available",
  "suite": {
    "suite_id": "generated-v1",
    "suite_version": "1.1.0",
    "manifest_sha256": "sha256:abababababababababababababababababababababababababababababababab",
    "generator": {
      "name": "noema-casegen",
      "version": "1.1.0",
      "seed": 20261020
    }
  },
  "pack_version": "fin@1.0.0",
  "policy_version": "fin.pol@3.1",
  "commit_sha": null,
  "providers": [],
  "counter_sources": {
    "oracle_accesses_by_runtime": "mock-case refusal log mock-case.log (listener=bench, msg=refused)",
    "model_governance_changes": "Record events written_by=MODEL",
    "monetary_calls": "declared by the operator: mock-case only run, no monetary route"
  },
  "counts": {
    "total": 320,
    "run": 0,
    "completed": 0,
    "error": 0,
    "invalid": 0
  },
  "errors_by_code": {},
  "invalid_case_ids": [],
  "clock_start": "2026-10-01T09:40:00+01:00"
}
